<?xml version="1.0" encoding="UTF-8"?>
<!DOCTYPE data SYSTEM "../../../lib/pkp/dtd/xmlData.dtd">

<!--
  * 3.1.2_update.xml
  *
  * Copyright (c) 2014-2021 Simon Fraser University
  * Copyright (c) 2003-2021 John Willinsky
  * Distributed under the GNU GPL v3. For full terms see the file docs/COPYING.
  *
  * 3.1.2.0 general updates.
  -->
<data>
	<!-- pkp/pkp-lib#2894 pkp/pkp-lib#4036 Set 0 review ratings to NULL -->
	<sql>
		<query>UPDATE review_assignments SET quality = NULL WHERE quality = 0</query>
	</sql>
	<sql><!-- Move User from app-specific to shared lib -->
		<query>UPDATE filter_groups SET input_type='class::lib.pkp.classes.user.User[]' WHERE input_type='class::classes.user.User[]'</query>
		<query>UPDATE filter_groups SET output_type='class::lib.pkp.classes.user.User[]' WHERE output_type='class::classes.user.User[]'</query>
	</sql>
	<sql><!-- pkp/pkp-lib#4311 Change CC licenses to HTTPS URLs -->
		<query>UPDATE submission_settings SET setting_value='https://creativecommons.org/licenses/by-nc-nd/4.0' WHERE setting_value='http://creativecommons.org/licenses/by-nc-nd/4.0' AND setting_name='licenseUrl'</query>
		<query>UPDATE submission_settings SET setting_value='https://creativecommons.org/licenses/by-nc/4.0' WHERE setting_value='http://creativecommons.org/licenses/by-nc/4.0' AND setting_name='licenseUrl'</query>
		<query>UPDATE submission_settings SET setting_value='https://creativecommons.org/licenses/by-nc-sa/4.0' WHERE setting_value='http://creativecommons.org/licenses/by-nc-sa/4.0' AND setting_name='licenseUrl'</query>
		<query>UPDATE submission_settings SET setting_value='https://creativecommons.org/licenses/by-nd/4.0' WHERE setting_value='http://creativecommons.org/licenses/by-nd/4.0' AND setting_name='licenseUrl'</query>
		<query>UPDATE submission_settings SET setting_value='https://creativecommons.org/licenses/by/4.0' WHERE setting_value='http://creativecommons.org/licenses/by/4.0' AND setting_name='licenseUrl'</query>
		<query>UPDATE submission_settings SET setting_value='http://creativecommons.org/licenses/by-sa/4.0' WHERE setting_value='http://creativecommons.org/licenses/by-sa/4.0' AND setting_name='licenseUrl'</query>
	</sql>
	<!-- pkp/pkp-lib#4345 Ensure declined submissions are moved to archive -->
	<sql>
		<query>UPDATE submissions SET status=4 WHERE submission_id IN (SELECT e1.submission_id FROM edit_decisions e1 LEFT JOIN edit_decisions e2 ON (e2.submission_id = e1.submission_id AND e2.date_decided > e1.date_decided) WHERE e1.decision IN (4, 9) AND e2.edit_decision_id IS NULL) AND status=1</query><!-- STATUS_DECLINED; SUBMISSION_EDITOR_DECISION_DECLINE; SUBMISSION_EDITOR_DECISION_INITIAL_DECLINE; STATUS_QUEUED -->
	</sql>
	<!-- remove and rename old crossref status settings after the new deposit API integrat -->
	<sql>
		<query>DELETE FROM submission_settings WHERE setting_name = 'crossref::status' AND setting_value IN ('submitted', 'failed', 'completed')</query>
		<query>DELETE FROM submission_settings WHERE setting_name = 'crossref::statusUrl'</query>
		<query>UPDATE submission_settings SET setting_value = 'registered' WHERE setting_name = 'crossref::status' AND setting_name = 'found'</query>
	</sql>
	<sql><!-- pkp/pkp-lib#4561 Enable new metadata injection plugins -->
		<query>INSERT INTO plugin_settings (plugin_name, setting_name, setting_value, setting_type, context_id) SELECT 'googlescholarplugin', 'enabled', '1', 'bool', j.journal_id FROM journals j WHERE NOT EXISTS (SELECT ps.plugin_name FROM plugin_settings ps WHERE ps.plugin_name = 'googlescholarplugin' AND ps.context_id = j.journal_id)</query>
		<query>INSERT INTO plugin_settings (plugin_name, setting_name, setting_value, setting_type, context_id) SELECT 'dublincoremetaplugin', 'enabled', '1', 'bool', j.journal_id FROM journals j WHERE NOT EXISTS (SELECT ps.plugin_name FROM plugin_settings ps WHERE ps.plugin_name = 'dublincoremetaplugin' AND ps.context_id = j.journal_id)</query>
	</sql>
</data>
